{
  "base_branch": "main",
  "branch": "feat/example-42",
  "commit_range": "main...feat/example-42",
  "issue": 42,
  "local_self_review": {
    "progress_section": "## Local Self-Review",
    "recorded": true
  },
  "planning_links": {
    "findings": "https://github.com/owner/repo/blob/feat/example-42/.gcw/issues/42/findings.md",
    "progress": "https://github.com/owner/repo/blob/feat/example-42/.gcw/issues/42/progress.md",
    "task_plan": "https://github.com/owner/repo/blob/feat/example-42/.gcw/issues/42/task_plan.md"
  },
  "progress_comment_url": "https://github.com/owner/repo/issues/42#issuecomment-1",
  "review_request": {
    "issue_link": "Closes #42",
    "summary": "Adds the example capability.",
    "title": "feat: add example"
  },
  "risks": "Low risk; fixture only.",
  "validation": [
    {
      "command": "python3 -m unittest discover -s .agents/skills/gcw/tests",
      "result": "passed"
    }
  ]
}
