{
  "issue": 3,
  "branch": "gcw/issue-3",
  "base_branch": "master",
  "commit_range": "master...gcw/issue-3",
  "review_request": {
    "title": "docs: add project README.md",
    "summary": "Add root README.md as the GCW project entry point with overview, collaborator roles, main flow summary, and navigation to docs/workflow.md.",
    "issue_link": "Closes #3"
  },
  "validation": [
    {
      "command": "python3 -c \"from pathlib import Path; assert Path('README.md').is_file()\"",
      "result": "passed"
    },
    {
      "command": "python3 -m unittest discover -s .github/tests -p test_documentation_structure.py -k test_repository_markdown",
      "result": "passed"
    }
  ],
  "local_self_review": {
    "recorded": true,
    "progress_section": "## Local Self-Review"
  },
  "planning_links": {
    "task_plan": "https://github.com/fzf-labs/gcw/blob/gcw/issue-3/.gcw/issues/3/task_plan.md",
    "findings": "https://github.com/fzf-labs/gcw/blob/gcw/issue-3/.gcw/issues/3/findings.md",
    "progress": "https://github.com/fzf-labs/gcw/blob/gcw/issue-3/.gcw/issues/3/progress.md"
  },
  "progress_comment_url": "https://github.com/fzf-labs/gcw/issues/3#issuecomment-4697976894",
  "risks": "Low risk documentation-only change. Full documentation structure CI still expects other files (CONTRIBUTING.md, CONTEXT.md, etc.) outside this issue scope.",
  "scope": "README.md only; does not add CONTRIBUTING.md, CONTEXT.md, or other docs/*.md files.",
  "reviewer_notes": "Verify README content matches issue acceptance criteria and links to docs/workflow.md correctly."
}
